{
  "id": "tajweed-basics-01",
  "version": 1,
  "active": true,
  "title": "أَحْكَامُ التَّجْوِيدِ: الْمُسْتَوَى الْأَوَّلُ",
  "description": "خَمْسَةُ أَسْئِلَةٍ فِي أَحْكَامِ النُّونِ وَالْمِيمِ السَّاكِنَتَيْنِ وَالْمُدُودِ وَالْقَلْقَلَةِ.",
  "language": "ar",
  "createdAt": "2026-10-11",
  "source": "Sample quiz shipped with QuizCraft, based on the standard introductory chapters of tajweed.",
  "questions": [
    {
      "id": "q1",
      "text": "مَا حُكْمُ النُّونِ السَّاكِنَةِ إِذَا جَاءَ بَعْدَهَا حَرْفُ الْيَاءِ؟",
      "options": [
        {
          "id": "a",
          "text": "إِظْهَارٌ حَلْقِيٌّ"
        },
        {
          "id": "b",
          "text": "إِدْغَامٌ بِغُنَّةٍ"
        },
        {
          "id": "c",
          "text": "إِقْلَابٌ"
        },
        {
          "id": "d",
          "text": "إِخْفَاءٌ حَقِيقِيٌّ"
        }
      ],
      "correct": "b",
      "explanation": "الْيَاءُ مِنْ حُرُوفِ «يَرْمَلُونَ»، وَالْيَاءُ وَالْمِيمُ وَالنُّونُ وَالْوَاوُ يَكُونُ مَعَهَا الإِدْغَامُ بِغُنَّةٍ."
    },
    {
      "id": "q2",
      "text": "كَمْ حَرْفًا لِلْإِخْفَاءِ الْحَقِيقِيِّ؟",
      "options": [
        {
          "id": "a",
          "text": "سِتَّةٌ"
        },
        {
          "id": "b",
          "text": "عَشَرَةٌ"
        },
        {
          "id": "c",
          "text": "خَمْسَةَ عَشَرَ"
        },
        {
          "id": "d",
          "text": "سَبْعَةَ عَشَرَ"
        }
      ],
      "correct": "c",
      "explanation": "حُرُوفُ الْهِجَاءِ تِسْعَةٌ وَعِشْرُونَ، فَإِذَا أُخْرِجَتْ حُرُوفُ الإِظْهَارِ السِّتَّةُ وَحُرُوفُ الإِدْغَامِ السِّتَّةُ وَالْبَاءُ بَقِيَ خَمْسَةَ عَشَرَ حَرْفًا لِلْإِخْفَاءِ."
    },
    {
      "id": "q3",
      "text": "مَا مِقْدَارُ الْمَدِّ الْعَارِضِ لِلسُّكُونِ؟",
      "options": [
        {
          "id": "a",
          "text": "مِنْ حَرَكَتَيْنِ إِلَى سِتِّ حَرَكَاتٍ"
        },
        {
          "id": "b",
          "text": "حَرَكَتَانِ فَقَطْ"
        },
        {
          "id": "c",
          "text": "سِتُّ حَرَكَاتٍ لُزُومًا"
        },
        {
          "id": "d",
          "text": "أَرْبَعُ حَرَكَاتٍ لُزُومًا"
        }
      ],
      "correct": "a",
      "explanation": "الْمَدُّ الْعَارِضُ لِلسُّكُونِ جَائِزٌ، فَيُمَدُّ حَرَكَتَيْنِ أَوْ أَرْبَعًا أَوْ سِتًّا؛ لِأَنَّ السُّكُونَ عَارِضٌ بِسَبَبِ الْوَقْفِ."
    },
    {
      "id": "q4",
      "text": "أَيُّ هَذِهِ الْحُرُوفِ لَيْسَ مِنْ حُرُوفِ الْقَلْقَلَةِ؟",
      "options": [
        {
          "id": "a",
          "text": "الْقَافُ"
        },
        {
          "id": "b",
          "text": "الطَّاءُ"
        },
        {
          "id": "c",
          "text": "الْجِيمُ"
        },
        {
          "id": "d",
          "text": "السِّينُ"
        }
      ],
      "correct": "d",
      "explanation": "حُرُوفُ الْقَلْقَلَةِ مَجْمُوعَةٌ فِي قَوْلِهِمْ «قُطْبُ جَدٍّ»، وَالسِّينُ لَيْسَتْ مِنْهَا."
    },
    {
      "id": "q5",
      "text": "مَا حُكْمُ الْمِيمِ السَّاكِنَةِ إِذَا جَاءَ بَعْدَهَا مِيمٌ؟",
      "options": [
        {
          "id": "a",
          "text": "إِخْفَاءٌ شَفَوِيٌّ"
        },
        {
          "id": "b",
          "text": "إِظْهَارٌ شَفَوِيٌّ"
        },
        {
          "id": "c",
          "text": "إِدْغَامٌ بِغُنَّةٍ"
        },
        {
          "id": "d",
          "text": "إِقْلَابٌ"
        }
      ],
      "correct": "c",
      "explanation": "الْمِيمُ السَّاكِنَةُ مَعَ الْمِيمِ حَرْفَانِ مُتَمَاثِلَانِ، فَتُدْغَمُ الْأُولَى فِي الثَّانِيَةِ إِدْغَامًا كَامِلًا بِغُنَّةٍ."
    }
  ]
}
