{
  "id": "arabic-quiz",
  "version": 1,
  "active": true,
  "title": "أَحْكَامُ التَّجْوِيدِ — نَمُوذَجُ اخْتِبَارٍ",
  "description": "Arabic fixture with full diacritics, used across every text-handling test.",
  "language": "ar",
  "createdAt": "2026-10-11",
  "source": "Test fixture, not a real quiz.",
  "questions": [
    {
      "id": "q1",
      "text": "مَا حُكْمُ النُّونِ السَّاكِنَةِ إِذَا جَاءَ بَعْدَهَا حَرْفُ البَاءِ؟",
      "options": [
        {
          "id": "a",
          "text": "الإِظْهَارُ"
        },
        {
          "id": "b",
          "text": "الإِقْلَابُ"
        },
        {
          "id": "c",
          "text": "الإِدْغَامُ"
        },
        {
          "id": "d",
          "text": "الإِخْفَاءُ"
        }
      ],
      "correct": "b",
      "explanation": "إِذَا جَاءَ بَعْدَ النُّونِ السَّاكِنَةِ حَرْفُ البَاءِ قُلِبَتْ مِيمًا مُخْفَاةً مَعَ الْغُنَّةِ، وَهَذَا هُوَ الإِقْلَابُ."
    },
    {
      "id": "q2",
      "text": "كَمْ عَدَدُ حُرُوفِ الإِظْهَارِ الْحَلْقِيِّ؟",
      "options": [
        {
          "id": "a",
          "text": "أَرْبَعَةٌ"
        },
        {
          "id": "b",
          "text": "خَمْسَةٌ"
        },
        {
          "id": "c",
          "text": "سِتَّةٌ"
        },
        {
          "id": "d",
          "text": "سَبْعَةٌ"
        }
      ],
      "correct": "c",
      "explanation": "حُرُوفُ الإِظْهَارِ الْحَلْقِيِّ سِتَّةٌ: الْهَمْزَةُ وَالْهَاءُ وَالْعَيْنُ وَالْحَاءُ وَالْغَيْنُ وَالْخَاءُ."
    },
    {
      "id": "q3",
      "text": "مَا مِقْدَارُ الْمَدِّ الطَّبِيعِيِّ؟",
      "options": [
        {
          "id": "a",
          "text": "حَرَكَتَانِ"
        },
        {
          "id": "b",
          "text": "ثَلَاثُ حَرَكَاتٍ"
        },
        {
          "id": "c",
          "text": "أَرْبَعُ حَرَكَاتٍ"
        },
        {
          "id": "d",
          "text": "سِتُّ حَرَكَاتٍ"
        }
      ],
      "correct": "a",
      "explanation": "الْمَدُّ الطَّبِيعِيُّ مِقْدَارُهُ حَرَكَتَانِ، وَهُوَ الَّذِي لَا تَقُومُ ذَاتُ الْحَرْفِ إِلَّا بِهِ."
    },
    {
      "id": "q4",
      "text": "مَا حُكْمُ الْمِيمِ السَّاكِنَةِ إِذَا جَاءَ بَعْدَهَا حَرْفُ الْبَاءِ؟",
      "options": [
        {
          "id": "a",
          "text": "الإِظْهَارُ الشَّفَوِيُّ"
        },
        {
          "id": "b",
          "text": "الإِدْغَامُ الْمُتَمَاثِلُ"
        },
        {
          "id": "c",
          "text": "الإِقْلَابُ"
        },
        {
          "id": "d",
          "text": "الإِخْفَاءُ الشَّفَوِيُّ"
        }
      ],
      "correct": "d",
      "explanation": "الْمِيمُ السَّاكِنَةُ إِذَا وَقَعَ بَعْدَهَا بَاءٌ تُخْفَى مَعَ الْغُنَّةِ، وَيُسَمَّى الإِخْفَاءَ الشَّفَوِيَّ."
    },
    {
      "id": "q5",
      "text": "أَيُّ هَذِهِ الْحُرُوفِ مِنْ حُرُوفِ الْحَلْقِ؟",
      "options": [
        {
          "id": "a",
          "text": "الْبَاءُ"
        },
        {
          "id": "b",
          "text": "الْعَيْنُ"
        },
        {
          "id": "c",
          "text": "الْوَاوُ"
        },
        {
          "id": "d",
          "text": "الْفَاءُ"
        }
      ],
      "correct": "b",
      "explanation": "الْعَيْنُ حَرْفٌ حَلْقِيٌّ، وَالْبَاءُ وَالْوَاوُ وَالْفَاءُ مِنْ حُرُوفِ الشَّفَتَيْنِ."
    },
    {
      "id": "q6",
      "text": "مَا نَوْعُ الْمَدِّ فِي كَلِمَةِ ﴿الضَّالِّينَ﴾؟",
      "options": [
        {
          "id": "a",
          "text": "مَدُّ الْبَدَلِ"
        },
        {
          "id": "b",
          "text": "مَدٌّ مُتَّصِلٌ"
        },
        {
          "id": "c",
          "text": "مَدٌّ لَازِمٌ"
        },
        {
          "id": "d",
          "text": "مَدٌّ مُنْفَصِلٌ"
        }
      ],
      "correct": "c",
      "explanation": "اجْتَمَعَ الْمَدُّ وَالسُّكُونُ اللَّازِمُ فِي كَلِمَةٍ وَاحِدَةٍ، فَصَارَ مَدًّا لَازِمًا مِقْدَارُهُ سِتُّ حَرَكَاتٍ."
    }
  ]
}
